{
  "action_id": "house:119:2:265",
  "content_subject_sha256": "3038718cff700ef9f21ba0f2176775a94b1cb43e0061fed9b1e069d4e04ae254",
  "cross_domain_limitations": [],
  "exact_action_identity": "house:119:2:265",
  "house_stage": "amendment",
  "neutral_methodology": [
    "inventory_material_provisions_before_drafting",
    "separate_official_title_from_interpretation",
    "title_only_prohibited_without_independent_single_mechanism_finding",
    "exact_choice_only",
    "preserve_house_stage",
    "yea_supports_exact_choice_only",
    "nay_opposes_exact_choice_only",
    "present_and_not_voting_non_directional",
    "no_motive_or_broader_issue_inference",
    "parent_context_cannot_replace_narrow_action",
    "account_for_material_limits_exceptions_and_retained_provisions",
    "preserve_ambiguity",
    "no_safe_candidate_when_required"
  ],
  "official_action_date": "2026-07-21",
  "official_member_action": "nay",
  "operative_text_versions": [
    "RulesReport07202026",
    "RulesReport07202026-amendment-17"
  ],
  "packet_id": "action-interpretation-worker-packet:house:119:2:265:v2",
  "schema_version": "action_interpretation_worker_packet_v2",
  "sources": [
    {
      "deterministic_extraction": {
        "projection": {
          "action_date": "2026-07-21",
          "action_id": "house:119:2:265",
          "chamber": "house",
          "congress": 119,
          "house_action_stage": "amendment",
          "measure_identity": "house:119:2:265",
          "member_action": "nay",
          "official_action_description": "On Agreeing to the Amendment",
          "operative_content_sha256": null,
          "raw_provenance_sha256": null,
          "roll_number": 265,
          "schema_version": "neutral_m3_source_projection_v1",
          "source_url": "https://clerk.house.gov/evs/2026/roll265.xml",
          "text_version": "2026-07-21"
        }
      },
      "neutral_projection_sha256": "0a89610791f70909df649a4db73ae95ee0fbce26b1c22ecc68684a2ac625a9fc",
      "raw_path": null,
      "raw_sha256": null,
      "role": "member_action_evidence",
      "source_id": "clerk:119:2:265",
      "source_type": "house_clerk_roll_call",
      "text_version": "2026-07-21"
    },
    {
      "deterministic_extraction": {
        "extraction_engine": "pypdf_6.10.0",
        "extraction_limitation": "Deterministic page-bound extraction preserves the governed PDF and page locators; line geometry and typography are not preserved.",
        "pages": [
          {
            "page": 75,
            "text": "D061526.101.xml 17. AN AMENDMENT TO BE OFFERED BY REPRESENTATIVE CRANK OF COLORADO OR A DESIGNEE, DEBATABLE FOR 10 MINUTES At the end of subtitle F of title X, add the following: SEC. 10__. CODIFICATION AND REVISION OF PROCESS BY WHICH CERTAIN DEPARTMENT OF DEFENSE PERSONNEL MAY BE PERMITTED TO CARRY FIREARMS ON A MILITARY INSTALLATION OR OTHER DEFENSE FACILITY. (a) I N G ENERAL.—Chapter 53 of title 10, United States Code, is amended by adding at the end the following new section: “§ 1060d.Firearms on military installations and other Defense facilities: process by which personnel may be permitted to carry “(a) A UTHORITY.—A member of the Armed Forces or civilian employee of the Department of Defense who is assigned to duty at a facility specified in subsection (b) may carry a firearm when on that facility if permitted to do so by the designated commander. Such permission constitutes an authorization for purposes of section 930(d)(2) of title 18. “(b) D ESIGNATED F ACILITIES.—For purposes of subsection (a), a facility designated in this subsection is any of the following located in the United States: “(1) A military installation. “(2) A military reserve center. “(3) An armed services recruiting center. “(4) Any other facility under the jurisdiction, custody, or control of the Department of Defense that is designated by the Secretary of Defense for purposes of this section. “(c) D ESIGNATED C OMMANDER.—For purposes of subsection (a), a designated commander, with respect to a facility specified in subsection (b), is an officer serving in a grade below a General or Flag Officer grade who is — “(1) the commander of the facility; or “(2) a military commander otherwise designated by the Secretary of Defense for the facility for purposes of this section. “(d) P RESUMPTION O F A PPROVAL.—In considering a request for permission to carry a firearm on a designated facility, the designated commander with respect to that facility may deny the request only for objective, clearly-described, individualized reasons. “(e) I MPLEMENTATION.—The Secretary of Defense shall establish a process for the implementation of this section. “(f) R ULE O F C ONSTRUCTION.—Nothing in this section shall be construed to limit the authority of the Secretary of Defense to permit additional individuals from seeking, or being granted, permission to carry a firearm on a facility designated in subsection (b) in accordance with procedures established by the Secretary.”. (b) D EADLINE.—The process required by subsection (e) of section 1060d of title 10, United States Code, as added by subsection (a), shall be implemented not later than December 31, 2027. (c) R EPEAL.—Section 526 of the National Defense Authorization Act for Fiscal Year 2016 (Public Law 114-92; 10 U.S.C. 2672 note) is repealed."
          }
        ]
      },
      "neutral_projection_sha256": "19ea98ac6287f94bab5bfa87e477d12942b30f7b4c3d0c2cdc47498846182690",
      "raw_path": "docs/editorial/full_record_reviews/source_readiness/evidence/10371c5bbbd18827c0aa7b59c41fb9e7c5fc938a80388ef10ae5cafb3c5aebab.pdf",
      "raw_sha256": "10371c5bbbd18827c0aa7b59c41fb9e7c5fc938a80388ef10ae5cafb3c5aebab",
      "role": "operative_content_interpretation_input",
      "source_id": "rules-report-2026-07-20-amendment-17",
      "source_type": "house_rules_committee_report",
      "text_version": "RulesReport07202026-amendment-17"
    },
    {
      "deterministic_extraction": {
        "extraction_engine": "pypdf_6.10.0",
        "extraction_limitation": "Deterministic page-bound extraction preserves the governed PDF and page locators; line geometry and typography are not preserved.",
        "pages": [
          {
            "page": 75,
            "text": "D061526.101.xml 17. AN AMENDMENT TO BE OFFERED BY REPRESENTATIVE CRANK OF COLORADO OR A DESIGNEE, DEBATABLE FOR 10 MINUTES At the end of subtitle F of title X, add the following: SEC. 10__. CODIFICATION AND REVISION OF PROCESS BY WHICH CERTAIN DEPARTMENT OF DEFENSE PERSONNEL MAY BE PERMITTED TO CARRY FIREARMS ON A MILITARY INSTALLATION OR OTHER DEFENSE FACILITY. (a) I N G ENERAL.—Chapter 53 of title 10, United States Code, is amended by adding at the end the following new section: “§ 1060d.Firearms on military installations and other Defense facilities: process by which personnel may be permitted to carry “(a) A UTHORITY.—A member of the Armed Forces or civilian employee of the Department of Defense who is assigned to duty at a facility specified in subsection (b) may carry a firearm when on that facility if permitted to do so by the designated commander. Such permission constitutes an authorization for purposes of section 930(d)(2) of title 18. “(b) D ESIGNATED F ACILITIES.—For purposes of subsection (a), a facility designated in this subsection is any of the following located in the United States: “(1) A military installation. “(2) A military reserve center. “(3) An armed services recruiting center. “(4) Any other facility under the jurisdiction, custody, or control of the Department of Defense that is designated by the Secretary of Defense for purposes of this section. “(c) D ESIGNATED C OMMANDER.—For purposes of subsection (a), a designated commander, with respect to a facility specified in subsection (b), is an officer serving in a grade below a General or Flag Officer grade who is — “(1) the commander of the facility; or “(2) a military commander otherwise designated by the Secretary of Defense for the facility for purposes of this section. “(d) P RESUMPTION O F A PPROVAL.—In considering a request for permission to carry a firearm on a designated facility, the designated commander with respect to that facility may deny the request only for objective, clearly-described, individualized reasons. “(e) I MPLEMENTATION.—The Secretary of Defense shall establish a process for the implementation of this section. “(f) R ULE O F C ONSTRUCTION.—Nothing in this section shall be construed to limit the authority of the Secretary of Defense to permit additional individuals from seeking, or being granted, permission to carry a firearm on a facility designated in subsection (b) in accordance with procedures established by the Secretary.”. (b) D EADLINE.—The process required by subsection (e) of section 1060d of title 10, United States Code, as added by subsection (a), shall be implemented not later than December 31, 2027. (c) R EPEAL.—Section 526 of the National Defense Authorization Act for Fiscal Year 2016 (Public Law 114-92; 10 U.S.C. 2672 note) is repealed."
          }
        ]
      },
      "neutral_projection_sha256": "4b826be54b4c5a97409fc3526f2cecb9dd25df6953c5b06af83c9fcbc8f374cd",
      "raw_path": "docs/editorial/full_record_reviews/source_readiness/evidence/10371c5bbbd18827c0aa7b59c41fb9e7c5fc938a80388ef10ae5cafb3c5aebab.pdf",
      "raw_sha256": "10371c5bbbd18827c0aa7b59c41fb9e7c5fc938a80388ef10ae5cafb3c5aebab",
      "role": "operative_content_interpretation_input",
      "source_id": "rules-report-2026-07-20:house:119:2:265",
      "source_type": "house_rules_committee_report",
      "text_version": "RulesReport07202026"
    }
  ],
  "worker_input_allowlist": [
    "action_id",
    "official_action_date",
    "house_stage",
    "official_member_action",
    "exact_action_identity",
    "neutral_projections",
    "operative_content",
    "cross_domain_limitations",
    "neutral_methodology",
    "materiality_rubric"
  ],